{
  "$schema": "https://json-schema.org/draft/2020-12/schema",
  "$id": "https://webgamefactory.dev/schemas/artifacts/tech-plan.schema.json",
  "title": "Technical Plan",
  "description": "Engine selection, architecture, performance budgets, repository parameters, and the development plan.\n\nEngine selection lives here rather than in a state of its own because `engine.type` is a repository-creation parameter: decide the engine, then create the repo. That ordering is load-bearing.\n\nThe development plan matters more than anything else in this artifact. A coding agent handed only a GDD will invent scope — it has to, because a GDD does not say what to build first. The plan supplies milestones, tasks, dependencies, acceptance criteria and tests, which is what makes agent output reviewable against something other than taste.\n\nSchema 1.1.0 adds `dev_plan.build_scope` (what the run's quality tier builds before G4: the design tiers whose features and content units get tasks, and the plan phases the developer builds) and `dev_plan.develop_budget` (the developer-session budget derived from those tasks, its basis, the installation's cap and any planned shortfall, which G3 sees). Both optional, so 1.0.0 artifacts stay valid.",

  "x-wgf": {
    "id": "tech-plan",
    "kind": "artifact",
    "format": "json",
    "version": "1.1.0",
    "template": "templates/tech-plan.md",
    "producer": "title:tech-plan",
    "consumers": ["title:tech-plan", "title:scaffolding", "title:prototype", "title:production", "release:qa", "release:draft"],
    "repo_path": "workspace/titles/<title-id>/tech-plan.json",
    "run_path": "<storage>/workflows/<run-id>/artifacts/tech-plan/v<n>.json",
    "rendered_to": "<game-repo>/docs/tech-plan.md",
    "required_for_gates": ["G3"]
  },

  "type": "object",
  "required": ["provenance", "title_id", "engine", "architecture", "perf_budgets", "repo_params", "dev_plan"],
  "properties": {
    "provenance": { "$ref": "./shared/provenance.schema.json#/$defs/provenance" },
    "title_id": { "type": "string" },

    "engine": {
      "type": "object",
      "required": ["type", "rationale"],
      "properties": {
        "type": {
          "enum": ["pixijs", "phaserjs", "threejs"],
          "description": "PixiJS or Phaser for 2D, Three.js for 3D. Driven by the game, not by preference. No other engine is supported by the template. Between the two 2D engines: PixiJS is a renderer and the default, so the game owns its scenes, input and tweens; Phaser brings its own scene manager, input, tweens, tilemaps and arcade physics, which is worth its larger bundle only when the game uses them."
        },
        "rationale": {
          "type": "string",
          "description": "Why this game needs this engine. '3D because it looks better' is not a rationale; load budget and asset pipeline cost are."
        },
        "version_constraint": { "type": "string" }
      },
      "additionalProperties": false
    },

    "architecture": {
      "type": "object",
      "description": "Covers the systems the template provides slots for. Each entry should say what is generic (template), what is game-specific, and what is platform-specific.",
      "properties": {
        "rendering": { "type": "string" },
        "physics": {
          "type": "string",
          "description": "How the game detects and resolves collisions, and the exact package if it needs one. A simulation library is a dependency, a bundle cost and a source of non-determinism, so it is decided here at G3 and never at development time: development may add only what this names. Custom collision in game code is the default and needs no package."
        },
        "game_core": { "type": "string" },
        "state": { "type": "string" },
        "input": { "type": "string" },
        "ui": { "type": "string" },
        "audio": { "type": "string" },
        "assets": { "type": "string" },
        "platform_sdk": { "type": "string" },
        "analytics": { "type": "string" },
        "persistence": { "type": "string" },
        "networking": { "type": ["string", "null"] }
      },
      "additionalProperties": false
    },

    "ownership": {
      "type": "object",
      "description": "Explicitly separating these prevents the most common scaffolding mistake: reimplementing in the game what the template already provides.",
      "properties": {
        "generic": { "type": "array", "items": { "type": "string" } },
        "game_specific": { "type": "array", "items": { "type": "string" } },
        "platform_specific": { "type": "array", "items": { "type": "string" } },
        "agent_responsibility": { "type": "array", "items": { "type": "string" } },
        "ci_responsibility": { "type": "array", "items": { "type": "string" } }
      },
      "additionalProperties": false
    },

    "perf_budgets": {
      "type": "object",
      "description": "Checked by the verify suite at release. Budgets set after the fact are not budgets.",
      "required": ["device_classes"],
      "properties": {
        "device_classes": {
          "type": "array",
          "minItems": 1,
          "items": {
            "type": "object",
            "required": ["id", "target_fps"],
            "properties": {
              "id": { "type": "string" },
              "description": { "type": "string" },
              "target_fps": { "type": "number" },
              "max_memory_mb": { "type": "number" },
              "max_time_to_interactive_s": { "type": "number" }
            },
            "additionalProperties": false
          }
        },
        "max_bundle_mb": {
          "type": "number",
          "description": "Must respect the tightest max_bundle_mb across required platform profiles."
        }
      },
      "additionalProperties": false
    },

    "repo_params": {
      "type": "object",
      "description": "Everything needed to create the game repository from web-game-template and write its game.config.yaml. The Factory never builds a repo from scratch.",
      "required": ["repo_name", "template_ref", "game_config"],
      "properties": {
        "repo_name": { "type": "string" },
        "template_ref": {
          "type": "string",
          "description": "The template repository and ref the game is created from, e.g. web-game-template@main."
        },
        "visibility": { "enum": ["private", "public"], "default": "private" },
        "game_config": {
          "type": "object",
          "description": "Written verbatim into game.config.yaml at scaffolding.",
          "required": ["game", "engine", "platforms", "build"],
          "properties": {
            "game": {
              "type": "object",
              "required": ["id", "name", "version"],
              "properties": {
                "id": { "type": "string" },
                "name": { "type": "string" },
                "version": { "type": "string" }
              },
              "additionalProperties": false
            },
            "engine": {
              "type": "object",
              "required": ["type"],
              "properties": { "type": { "enum": ["pixijs", "phaserjs", "threejs"] } },
              "additionalProperties": false
            },
            "platforms": {
              "type": "array",
              "items": {
                "type": "object",
                "required": ["id", "profile", "role"],
                "properties": {
                  "id": { "type": "string" },
                  "profile": {
                    "type": "string",
                    "description": "Pinned as <platform-id>@<profile-version> so a build is reproducible against the compliance rules in force."
                  },
                  "role": { "enum": ["required", "optional"] },
                  "game_id": {
                    "type": "string",
                    "pattern": "^[A-Za-z0-9_-]{8,64}$",
                    "description": "The Game ID the portal issued for this title, where the platform's profile has requirements.game_id. From workspace/titles/<title-id>/portals.yaml; never invented."
                  },
                  "hosting": {
                    "type": "string",
                    "description": "A non-default hosting mode from the profile's requirements.hosting. Absent means the portal's default."
                  },
                  "game_url": {
                    "type": "string",
                    "pattern": "^https://\\S+$",
                    "description": "hosting self-hosted only: the https URL the portal's wrapper page frames."
                  }
                },
                "additionalProperties": false
              }
            },
            "build": {
              "type": "object",
              "properties": {
                "command": { "type": "string" },
                "output": { "type": "string" }
              },
              "additionalProperties": false
            },
            "monetization": {
              "type": "object",
              "description": "The ad kinds the design committed to, carried into the game repository so release validation can evaluate a profile's uses_banner_ads and uses_rewarded_ads assertions against a DECLARATION rather than against whatever an end-to-end run happened to trigger. Observing a run can only prove an ad was requested, never that one was not; on GameVui `uses_rewarded_ads` is a blocking assertion, so the difference decides whether a title can ship there.\n\nDerived from game_design.monetization.placements[].kind — deduplicated, not decided here. A disagreement between this list and the design is a drift the tech plan should not be able to introduce silently.",
              "required": ["ad_kinds"],
              "properties": {
                "ad_kinds": {
                  "type": "array",
                  "items": { "enum": ["interstitial", "rewarded", "banner"] },
                  "uniqueItems": true,
                  "description": "Empty means the title shows no ads. `iap` is deliberately not here: it is not an ad kind and no profile asserts on it."
                },
                "iap": { "type": "boolean" }
              },
              "additionalProperties": false
            },
            "verification": {
              "type": "object",
              "properties": {
                "smoke_test": { "type": "boolean" },
                "performance_test": { "type": "boolean" },
                "mobile_test": { "type": "boolean" }
              },
              "additionalProperties": false
            },
            "publishing": {
              "type": "object",
              "properties": { "enabled": { "type": "boolean" } },
              "additionalProperties": false
            }
          },
          "additionalProperties": false
        }
      },
      "additionalProperties": false
    },

    "dev_plan": {
      "type": "object",
      "required": ["milestones", "tasks", "est_days"],
      "properties": {
        "est_days": { "type": "number" },
        "build_scope": {
          "type": "object",
          "description": "What the run builds before G4: its quality tier (the design's build_spec.content.quality_tier, else the strategy's concept.content_model.quality_tier, else mvp) and what that tier builds (core/reference/quality-benchmark.yaml tiers[].builds). At `release` the post-mvp features and content units are built before G4: in new-game nothing is built after it. Added in 1.1.0.",
          "required": ["quality_tier", "design_tiers", "plan_phases"],
          "properties": {
            "quality_tier": { "type": "string" },
            "design_tiers": { "type": "array", "minItems": 1, "items": { "enum": ["mvp", "post-mvp", "optional"] } },
            "plan_phases": { "type": "array", "minItems": 1, "items": { "enum": ["prototype", "production", "hardening"] } },
            "where": { "type": "string", "description": "Where the tier was stated." }
          },
          "additionalProperties": false
        },
        "develop_budget": {
          "type": "object",
          "description": "The developer-session budget the plan derives from its own tasks in the phases build_scope builds (core/reference/quality-benchmark.yaml develop): sessions = ceil(build hours / session_task_hours) + rework_sessions, cost = sessions x session_cost. The installation's factory.develop.budget may cap it lower; `shortfall` is what the cap leaves unfunded, reported at G3 as a high-severity risk. The develop step enforces the lower of the two from the first session. Added in 1.1.0.",
          "required": ["sessions", "cost", "basis"],
          "properties": {
            "sessions": { "type": "integer", "minimum": 0 },
            "cost": { "type": "number", "minimum": 0 },
            "basis": {
              "type": "object",
              "required": ["build_hours", "tasks", "session_task_hours", "rework_sessions", "session_cost"],
              "properties": {
                "build_hours": { "type": "number", "minimum": 0 },
                "tasks": { "type": "array", "items": { "type": "string" } },
                "content_tasks": { "type": "integer", "minimum": 0 },
                "content_hours": { "type": "number", "minimum": 0 },
                "content_unit_hours": { "type": ["number", "null"] },
                "session_task_hours": { "type": "number", "exclusiveMinimum": 0 },
                "build_sessions": { "type": "integer", "minimum": 0 },
                "rework_sessions": { "type": "number", "minimum": 0 },
                "session_cost": { "type": "number", "minimum": 0 },
                "calibration": {
                  "type": "object",
                  "additionalProperties": { "type": ["string", "null"] }
                },
                "source": { "type": "string" },
                "formula": { "type": "string" }
              },
              "additionalProperties": false
            },
            "cap": {
              "type": ["object", "null"],
              "description": "The installation's cap in force when the plan was made (the run's factory.develop.budget snapshot and any raise a person recorded), or null: no cap, and then no command developer starts.",
              "properties": {
                "max_sessions": { "type": "integer", "minimum": 1 },
                "max_cost": { "type": "number", "exclusiveMinimum": 0 },
                "source": { "type": "string" }
              },
              "additionalProperties": false
            },
            "shortfall": {
              "type": ["object", "null"],
              "description": "What the cap leaves unfunded of the plan's need, or null.",
              "properties": {
                "sessions": { "type": "integer", "minimum": 1 },
                "cost": { "type": "number", "exclusiveMinimum": 0 }
              },
              "additionalProperties": false
            }
          },
          "additionalProperties": false
        },
        "milestones": {
          "type": "array",
          "minItems": 1,
          "items": {
            "type": "object",
            "required": ["id", "label", "est_days", "exit_criteria"],
            "properties": {
              "id": { "type": "string" },
              "label": { "type": "string" },
              "phase": { "enum": ["prototype", "production", "hardening"] },
              "est_days": { "type": "number" },
              "exit_criteria": { "type": "array", "items": { "type": "string" } }
            },
            "additionalProperties": false
          }
        },
        "tasks": {
          "type": "array",
          "minItems": 1,
          "description": "The unit an agent actually works from. Acceptance criteria and tests are required: a task without them cannot be verified and will be reported complete when it is not.",
          "items": {
            "type": "object",
            "required": ["id", "title", "milestone", "acceptance_criteria"],
            "properties": {
              "id": { "type": "string", "pattern": "^[A-Z]+-[0-9]+$" },
              "title": { "type": "string" },
              "milestone": { "type": "string" },
              "phase": { "type": "string" },
              "description": { "type": "string" },
              "dependencies": { "type": "array", "items": { "type": "string" } },
              "acceptance_criteria": { "type": "array", "minItems": 1, "items": { "type": "string" } },
              "tests": { "type": "array", "items": { "type": "string" } },
              "assets": { "type": "array", "items": { "type": "string" } },
              "est_hours": { "type": "number" },
              "status": { "enum": ["todo", "in-progress", "blocked", "done"], "default": "todo" }
            },
            "additionalProperties": false
          }
        }
      },
      "additionalProperties": false
    },

    "technical_risks": {
      "type": "array",
      "items": {
        "type": "object",
        "required": ["description", "severity", "mitigation"],
        "properties": {
          "description": { "type": "string" },
          "severity": { "enum": ["low", "medium", "high"] },
          "mitigation": { "type": "string" }
        },
        "additionalProperties": false
      }
    },

    "sdk_integration": {
      "type": "object",
      "properties": {
        "platform_sdks": { "type": "array", "items": { "type": "string" } },
        "analytics_events": { "type": "array", "items": { "type": "string" } },
        "note": {
          "type": "string",
          "description": "Game code calls the template's platform abstraction, never a portal SDK directly."
        }
      },
      "additionalProperties": false
    },

    "release_requirements": {
      "type": "array",
      "items": { "type": "string" }
    }
  },
  "additionalProperties": false
}
