{
  "provenance": {
    "artifact_id": "wgf:tech-plan:ice-slide:20261003-02",
    "artifact_type": "tech-plan",
    "schema_version": "1.0.0",
    "opportunity_id": "opp-b40899dc",
    "title_id": "ice-slide",
    "produced_by": {
      "role": "architect",
      "actor": "automation"
    },
    "produced_at": "2026-10-03T05:37:27Z",
    "inputs": [
      {
        "artifact_id": "wgf:game-design:ice-slide:20261003-06",
        "artifact_type": "game-design",
        "content_hash": "sha256:54887df7763a4d5d445d0bf2bc17ded2a3eaa84f37542077ecd3486ee41798d8"
      },
      {
        "artifact_id": "wgf:title-strategy:ice-slide:20261002-01",
        "artifact_type": "title-strategy",
        "content_hash": "sha256:f9f6e1479ea590ae721d7cefaab185849d247f4fe226fac0bcd08a29ae87adcc"
      }
    ],
    "content_hash": "sha256:ce74dcbe58328dfec6c66f26322abf98b30e5b68b1a8b11288b52213a863ce0d",
    "status": "draft"
  },
  "title_id": "ice-slide",
  "engine": {
    "type": "pixijs",
    "rationale": "The design is drawn for 2D and declares pixijs. The play happens on a flat ice-grid plane: a sliding puzzle needs no depth to read, and 2D with vector art keeps the first load small on portal traffic, where time to first play decides whether the player stays."
  },
  "architecture": {
    "rendering": "pixijs (2d) through the template's renderer seam (createRenderer, @wgf/pixi-framework); no other engine is loaded.",
    "physics": "Custom collision and overlap tests in src/game/, engine-free and unit testable; no physics dependency. A simulation library is a superseding tech-plan decision at G3, never development's.",
    "game_core": "Template packages/game-core: loop, scenes, events, pause. Game states and mechanics from the design's build_spec live in src/.",
    "state": "Game state machine from build_spec.game_states, in src/; persistence through the platform storage abstraction.",
    "input": "build_spec.controls mapped onto the template's input handling.",
    "ui": "Screens, HUD and menus from build_spec, rendered with the selected engine.",
    "audio": "Template audio slot; content per the design's audio direction.",
    "assets": "The asset-manifest under public/assets/; the bundle stays within 150 MB.",
    "platform_sdk": "@wgf/platform-sdk only; the adapter is chosen from game.config.yaml platforms, never by game code.",
    "analytics": "@wgf/analytics-sdk event vocabulary.",
    "persistence": "platform storage (cloud where the profile allows, local otherwise).",
    "networking": null
  },
  "ownership": {
    "generic": [
      "packages/* (game-core, platform-sdk, analytics-sdk, renderers)",
      "build, test and release tooling",
      "CI pipelines"
    ],
    "game_specific": [
      "src/: mechanics, states, screens, content"
    ],
    "platform_specific": [
      "poki@1.0.0 via its adapter and config/platforms/",
      "crazygames@1.0.0 via its adapter and config/platforms/",
      "yandex@1.0.0 via its adapter and config/platforms/"
    ],
    "agent_responsibility": [
      "dev_plan tasks, against their acceptance criteria"
    ],
    "ci_responsibility": [
      "ci_green (ci.yml)",
      "verify_suite_green (verify.yml)"
    ]
  },
  "perf_budgets": {
    "device_classes": [
      {
        "id": "mobile-mid",
        "description": "Mid-range phone, portal webview",
        "target_fps": 60,
        "max_time_to_interactive_s": 5
      },
      {
        "id": "desktop",
        "description": "Desktop browser",
        "target_fps": 60,
        "max_time_to_interactive_s": 5
      }
    ],
    "max_bundle_mb": 150
  },
  "repo_params": {
    "repo_name": "ice-slide",
    "template_ref": "Cuvara/web-game-template@b1062619457f427bac91b45f6a96762f256a945a",
    "visibility": "private",
    "game_config": {
      "game": {
        "id": "ice-slide",
        "name": "Ice Slide",
        "version": "0.1.0"
      },
      "engine": {
        "type": "pixijs"
      },
      "platforms": [
        {
          "id": "poki",
          "profile": "poki@1.0.0",
          "role": "required"
        },
        {
          "id": "crazygames",
          "profile": "crazygames@1.0.0",
          "role": "optional"
        },
        {
          "id": "yandex",
          "profile": "yandex@1.0.0",
          "role": "optional"
        }
      ],
      "build": {
        "command": "pnpm build",
        "output": "dist"
      },
      "monetization": {
        "ad_kinds": [
          "interstitial",
          "rewarded"
        ],
        "iap": false
      },
      "verification": {
        "smoke_test": true,
        "performance_test": true,
        "mobile_test": true
      },
      "publishing": {
        "enabled": false
      }
    }
  },
  "dev_plan": {
    "est_days": 4.5,
    "milestones": [
      {
        "id": "M1",
        "label": "Playable core loop",
        "phase": "prototype",
        "est_days": 3.5,
        "exit_criteria": [
          "Every mvp feature meets its acceptance criteria",
          "Every MVP content unit is in public/content/units.json and reachable in play",
          "The prototype answers the strategy's prototype_must_prove questions"
        ]
      },
      {
        "id": "M2",
        "label": "Production scope",
        "phase": "production",
        "est_days": 0.5,
        "exit_criteria": [
          "Every post-mvp feature meets its acceptance criteria"
        ]
      },
      {
        "id": "M3",
        "label": "Platform integration and hardening",
        "phase": "hardening",
        "est_days": 0.5,
        "exit_criteria": [
          "Every target platform's blocking assertions pass",
          "The verify suite is green"
        ]
      }
    ],
    "tasks": [
      {
        "id": "CORE-001",
        "title": "Boot the game on the template with engine pixijs",
        "milestone": "M1",
        "phase": "prototype",
        "description": "game.config.yaml as written at scaffolding: the engine the plan selected and the pinned platforms. Game code goes in src/; packages/ are the template's and are not edited.",
        "acceptance_criteria": [
          "The game boots with engine.type pixijs and the first required platform's adapter",
          "The template's ci pipeline is green before any game code lands"
        ],
        "tests": [
          "tests/e2e (template smoke)"
        ],
        "est_hours": 0.3,
        "status": "todo"
      },
      {
        "id": "GAME-001",
        "title": "Implement Ice board",
        "milestone": "M1",
        "phase": "prototype",
        "description": "A grid of ice tiles bounded by walls and rocks that a slide stops against.",
        "dependencies": [
          "CORE-001"
        ],
        "acceptance_criteria": [
          "The board is between 6x6 and 9x9 depending on the level, and every cell is ice, wall, rock, or the goal.",
          "Every authored board is solvable inside its move cap, and the level data stores that solution's length.",
          "Strategy MVP: 6 designed levels with authored difficulty on depth, move-limit, board-complexity, piece-variety."
        ],
        "tests": [
          "tests/unit/ice-board.spec.ts"
        ],
        "est_hours": 0.6499999999999999,
        "status": "todo"
      },
      {
        "id": "GAME-002",
        "title": "Implement Directional slide",
        "milestone": "M1",
        "phase": "prototype",
        "description": "A tapped or swiped direction sends the penguin sliding cell by cell until it hits a wall, a rock, a closed door, or the board's edge.",
        "dependencies": [
          "CORE-001"
        ],
        "acceptance_criteria": [
          "The penguin moves every open cell in the chosen direction and stops in the last cell before whatever blocks it.",
          "A slide costs one move whether it travels one cell or the whole board.",
          "Choosing a direction the penguin cannot move in (blocked on the very first cell) costs no move."
        ],
        "tests": [
          "tests/unit/slide.spec.ts"
        ],
        "est_hours": 0.6499999999999999,
        "status": "todo"
      },
      {
        "id": "GAME-003",
        "title": "Implement Goal tile",
        "milestone": "M1",
        "phase": "prototype",
        "description": "A marked exit tile; the penguin stopping on it clears the level.",
        "dependencies": [
          "CORE-001"
        ],
        "acceptance_criteria": [
          "The penguin's slide ending exactly on the goal tile clears the level immediately.",
          "The goal tile is visually distinct from ice, wall, rock, key, door and crumbling tiles at a glance."
        ],
        "tests": [
          "tests/unit/goal-tile.spec.ts"
        ],
        "est_hours": 0.5,
        "status": "todo"
      },
      {
        "id": "GAME-004",
        "title": "Implement Move budget and stars",
        "milestone": "M1",
        "phase": "prototype",
        "description": "Each level carries a par move count and a hard move cap; reaching the goal inside the cap wins, and how close to par decides one to three stars.",
        "dependencies": [
          "CORE-001"
        ],
        "acceptance_criteria": [
          "Every slide decrements the level's moves-left counter by one.",
          "Reaching the goal with moves-left at or above the level's 3-star threshold awards three stars; lower thresholds award two or one.",
          "Moves-left reaching zero before the goal is reached fails the level and offers an immediate retry on the same board.",
          "Strategy MVP: Core loop: read the level, plan the moves, solve it, advance to a harder level that adds a rule or tightens the budget.",
          "Strategy MVP: The brief, built in full: A sliding-ice puzzle: a penguin slides until it hits something; 24 hand-designed levels with keys, doors, crumbling tiles and a 3-star move target."
        ],
        "tests": [
          "tests/unit/move-budget.spec.ts"
        ],
        "est_hours": 0.95,